{
  "schema": "SessionContentGateV1",
  "schemaVersion": 1,
  "gateId": "content-gate-0972746d7bd7",
  "allowed": true,
  "sessionShapeId": null,
  "intensityCeiling": 0.44,
  "checked": {
    "passageId": "candle_refuses_dark",
    "dreamWeatherId": "weather-777",
    "dreamJourneySummary": "entry:Boundless White Void -> pressure:Space / Black Hole -> mirror:Space / Black Hole -> return:Boundless White Void",
    "maskId": "double"
  },
  "suppressedTags": [],
  "warnings": [
    "passage.pressureTags.hope outside allowedPressureTags",
    "passage.pressureTags.refusal outside allowedPressureTags"
  ],
  "blockedReasons": [],
  "replacementHints": {
    "preferredToneTags": [
      "curious",
      "deep"
    ],
    "allowedPressureTags": [
      "threshold",
      "word",
      "lamp",
      "breath"
    ],
    "passageIntensityBand": "gentle",
    "weatherPressure": "medium",
    "returnAnchorKind": "image",
    "groundingPreference": "quiet_room"
  },
  "playerFacingText": null
}
